{
  "format": "deployment-ops/bootstrap-selection/v1",
  "purpose": "source-only",
  "domain_id": "a6606aee-cb29-5360-a578-3502f7b0a12a",
  "source_id": "domain",
  "ref": "refs/heads/main",
  "expected_commit": "1111111111111111111111111111111111111111",
  "adapter": {
    "implementation": "fishhat.git-bundle",
    "installation_digest": "sha256:aaaaaaaaaaaaaaaaaaaaaaaaaaaaaaaaaaaaaaaaaaaaaaaaaaaaaaaaaaaaaaaa",
    "descriptor_digest": "sha256:fedec0747890c002d330630b68a7e2e494b61e7604fe1e04430b25774bdb61ca",
    "configuration_digest": "sha256:6a609f6a9b32d303d3df8e174e088dce83f80bc40fc0c3684481aaa0932b6863",
    "source_schema_digest": "sha256:a408ecd3405dc8db016e2bcd5c16adfb835aa1a586cf9c285bbf59a5192f2f4f"
  },
  "capture": {
    "digest": "sha256:946fa6445744e86ae38e3792badc8ff76a1898aa46c79072eab716e2d1d77dc5",
    "media_type": "application/json",
    "size_bytes": 184
  },
  "catalogue_digest": "sha256:b926e995e0e90ded4a61e91240c7b2a9d733c43c23a7226565b8affcdbe6e364",
  "kit_manifest_digest": "sha256:aaaaaaaaaaaaaaaaaaaaaaaaaaaaaaaaaaaaaaaaaaaaaaaaaaaaaaaaaaaaaaaa",
  "recovery_root": "/recovery/staging/run-001",
  "verify_only": true,
  "force_checkout": false,
  "install_dependencies": false,
  "download_tools": false,
  "full_service_restore_separate": true
}
